QuestionText,Category,Answer
أيهما أفضل الدراسة في السابق أم في الوقت الحالي,التعليم,الدراسة في الوقت الحالي تعتبر أفضل بسبب توفر التكنولوجيا والموارد التعليمية الحديثة
أليس القطن عماد الثروة في مصر,الاقتصاد والعمل,القطن يعتبر من أهم المنتجات الزراعية في مصر ويعد من الأعمدة الرئيسية للاقتصاد المصري
أتصعد الشمس من الشرق,التعليم,الشمس تصعد من الشرق
أتعرف البكتيريا بأنها كائنات حية دقيقة,التعليم,البكتيريا تعرف بأنها كائنات حية دقيقة
أيتكون الهواء أساسا من النيتروجين,التعليم,الهواء يتكون أساسا من النيتروجين
أيفرز البنكرياس الأنسولين,الصحة,يفرز البنكرياس الأنسولين
أيتكون الماء من الهيدروجين والأوكسجين,التعليم,الماء يتكون من الهيدروجين والأوكسجين
أيوجد فيتامين سي في البرتقال,الصحة,فيتامين سي يوجد في البرتقال
أيتنفس السمك باستخدام الخياشيم,التعليم,يتنفس السمك باستخدام الخياشيم
أيمكن للنباتات أن تقوم بعملية البناء الضوئي,التعليم,يمكن للنباتات أن تقوم بعملية البناء الضوئي
أيتكون الذهب من عنصر واحد,التعليم,يتكون الذهب من عنصر واحد
أيتكون الخشب من ألياف نباتية,التعليم,يتكون الخشب من ألياف نباتية
أيتغذى الأسد على اللحوم,التعليم,يتغذى الأسد على اللحوم
أيتكون الدم من خلايا حمراء وبيضاء,الصحة,يتكون الدم من خلايا حمراء وبيضاء
أيتغذى النحل على رحيق الأزهار,التعليم,يتغذى النحل على رحيق الأزهار
أيتكون اللبن من بروتينات ودهون,التعليم,يتكون اللبن من بروتينات ودهون
أيمكن للحشرات أن تطير,التعليم,يمكن للحشرات أن تطير
أيتغذى الدب القطبي على اللحوم,التعليم,يتغذى الدب القطبي على اللحوم
أيتكون الزيت من دهون نباتية,التعليم,يتكون الزيت من دهون نباتية
أيتكون السكر من جزيئات كربون وأوكسجين,التعليم,يتكون السكر من جزيئات كربون وأوكسجين
أيتكون الحجر الجيري من كربونات الكالسيوم,التعليم,يتكون الحجر الجيري من كربونات الكالسيوم
أيتغذى الفيل على النباتات,التعليم,يتغذى الفيل على النباتات
أيتكون الهواء من خليط من الغازات,التعليم,يتكون الهواء من خليط من الغازات
أيمكن للنمل أن يرفع أوزانا تفوق وزنه,التعليم,يمكن للنمل أن يرفع أوزانا تفوق وزنه
أيتكون الزجاج من رمل السيليكا,التعليم,يتكون الزجاج من رمل السيليكا
أيتطلب الحاسوب وجود تيار كهربائي,التكنولوجيا,يتطلب الحاسوب وجود تيار كهربائي
أيمكن للطيور أن تعيش في الماء,التعليم,معظم الطيور لا يمكنها أن تعيش في الماء
أيتغذى الحوت على الكائنات البحرية الصغيرة,التعليم,يتغذى الحوت على الكائنات البحرية الصغيرة
أيمكن للإنسان أن يعيش بدون قلب,الصحة,لا يمكن للإنسان أن يعيش بدون قلب
أيتغير لون أوراق الأشجار في الخريف,التعليم,يتغير لون أوراق الأشجار في الخريف
أيمكن للضوء أن ينكسر عند مروره خلال الماء,التعليم,يمكن للضوء أن ينكسر عند مروره خلال الماء
أيتكون الجليد عند درجات حرارة منخفضة,التعليم,يتكون الجليد عند درجات حرارة منخفضة
أيتحكم الدماغ في جميع وظائف الجسم,التعليم,يتحكم الدماغ في جميع وظائف الجسم
أيمكن للإنسان أن يسمع الأصوات من جميع الاتجاهات,الصحة,يمكن للإنسان أن يسمع الأصوات من جميع الاتجاهات
أيوجد الماء في حالات صلبة وسائلة وغازية,التعليم,يوجد الماء في حالات صلبة وسائلة وغازية
أيمكن للإنسان أن يشعر بالحرارة والبرودة,الصحة,يمكن للإنسان أن يشعر بالحرارة والبرودة
أيتكون الرمل من جزيئات صغيرة من الصخور,التعليم,يتكون الرمل من جزيئات صغيرة من الصخور
أيتطلب النمو السليم للنباتات وجود ضوء الشمس,التعليم,يتطلب النمو السليم للنباتات وجود ضوء الشمس
أيمكن للإنسان أن يرى في الظلام,التعليم,لا يمكن للإنسان أن يرى في الظلام
أيمكن للإنسان أن يعيش على سطح القمر,التعليم,لا يمكن للإنسان أن يعيش على سطح القمر بدون معدات خاصة
أيتكون الفحم من بقايا نباتية,التعليم,يتكون الفحم من بقايا نباتية
أيتغير لون السماء حسب الوقت من اليوم,التعليم,يتغير لون السماء حسب الوقت من اليوم
أيتحرك الهواء من مناطق الضغط العالي إلى المنخفض,التعليم,يتحرك الهواء من مناطق الضغط العالي إلى المنخفض
أيتطلب التنفس وجود الأوكسجين,الصحة,يتطلب التنفس وجود الأوكسجين
أيمكن للنباتات أن تنمو بدون ماء,التعليم,لا يمكن للنباتات أن تنمو بدون ماء
أيتغير لون البشرة بالتعرض للشمس,الصحة,يتغير لون البشرة بالتعرض للشمس
أيتطلب التبخر وجود حرارة,التعليم,يتطلب التبخر وجود حرارة
أيمكن للإنسان أن يعيش بدون نوم,الصحة,لا يمكن للإنسان أن يعيش بدون نوم لفترة طويلة
أيتغير لون السمك مع تغير البيئة,التعليم,يتغير لون السمك مع تغير البيئة
أيتطلب النمو السليم للإنسان وجود غذاء متوازن,الصحة,يتطلب النمو السليم للإنسان وجود غذاء متوازن
أيتغير لون الثلج مع التلوث,البيئة والطاقة,يمكن أن يتغير لون الثلج مع التلوث
أيمكن للإنسان أن يرى الأشياء بواسطة العيون,الصحة,يمكن للإنسان أن يرى الأشياء بواسطة العيون
هل سيدنا محمد صلى الله عليه و سلم هو أول المسلمين,الدين,نعم سيدنا محمد صلى الله عليه و سلم يعتبر أول المسلمين
هل يؤثم الحاكم الذي لا يحكم بما أنزل الله وشرع,الدين,نعم يؤثم الحاكم الذي لا يحكم بما أنزل الله وشرع
هل الماء يتجمد عند درجة حرارة صفر مئوية,التعليم,الماء يتجمد عند درجة حرارة صفر مئوية
هل الشمس هي أقرب نجم إلى الأرض,التعليم,الشمس هي أقرب نجم إلى الأرض
هل نجيب محفوظ هو مؤلف رواية الأيام,الثقافة,طه حسين هو مؤلف رواية الأيام
هل الزرافة هي أطول حيوان بري,التعليم,الزرافة هي أطول حيوان بري
هل تعد اللغة الصينية من اللغات السامية,الثقافة,اللغة الصينية ليست من اللغات السامية
هل يستخدم الذهب في صناعة الإلكترونيات,التكنولوجيا,يستخدم الذهب في صناعة الإلكترونيات
هل تحتوي الخلية النباتية على جدار خلوي,التعليم,تحتوي الخلية النباتية على جدار خلوي
هل يمكن للحوت الأزرق أن يتنفس تحت الماء,التعليم,لا يمكن للحوت الأزرق أن يتنفس تحت الماء
هل يمكن للبكتيريا أن تعيش في ظروف خالية من الأكسجين,الصحة,يمكن للبكتيريا أن تعيش في ظروف خالية من الأوكسجين
هل تستخدم الخلايا الشمسية لتحويل الطاقة الشمسية إلى كهرباء,التكنولوجيا,تستخدم الخلايا الشمسية لتحويل الطاقة الشمسية إلى كهرباء
هل تعد الدلافين من الثدييات,التعليم,تعد الدلافين من الثدييات
هل يمكن للإنسان أن يرى بالأشعة تحت الحمراء,التعليم,لا يمكن للإنسان أن يرى بالأشعة تحت الحمراء
هل يعتبر الفحم من الموارد المتجددة,الاقتصاد والعمل,الفحم ليس من الموارد المتجددة
هل نهر النيل هو أطول نهر في العالم,التعليم,نهر النيل هو أطول نهر في العالم
هل يستخدم الزئبق في موازين الحرارة التقليدية,التكنولوجيا,يستخدم الزئبق في موازين الحرارة التقليدية
هل يعتبر الزجاج موصل جيد للحرارة,التعليم,الزجاج ليس موصل جيد للحرارة
هل تعتبر الزهرة ثاني كوكب في النظام الشمسي,التعليم,الزهرة هي ثاني كوكب في النظام الشمسي
هل يستخدم الحديد في صناعة السيارات,التكنولوجيا,يستخدم الحديد في صناعة السيارات
هل يعتبر الزيتون من الفواكه,الثقافة,يعتبر الزيتون من الفواكه
هل تعد القهوة مشروبا يحتوي على الكافيين,الثقافة,القهوة تحتوي على الكافيين
هل يمكن للحيوانات البرمائية أن تعيش في الماء وعلى اليابسة,التعليم,يمكن للحيوانات البرمائية أن تعيش في الماء وعلى اليابسة
هل تستخدم الألياف البصرية لنقل البيانات,التكنولوجيا,تستخدم الألياف البصرية لنقل البيانات
هل يعد الكتاب المقدس أقدم نص ديني معروف,الدين,الكتاب المقدس ليس أقدم نص ديني معروف
هل تعتبر الماس من الأحجار الكريمة,الثقافة,تعتبر الماس من الأحجار الكريمة
هل يستخدم الفلين في صناعة الزجاجات,التكنولوجيا,يستخدم الفلين في صناعة الزجاجات
هل تعد الحيتان من الأسماك,التعليم,الحيتان ليست من الأسماك هي من الثدييات
هل يمكن للنباتات أن تنمو بدون ضوء الشمس,التعليم,لا يمكن للنباتات أن تنمو بدون ضوء الشمس
هل يعتبر الذهب أثقل من الحديد,التعليم,يعتبر الذهب أثقل من الحديد
هل تستخدم الحواسيب في التنبؤ بحالة الطقس,التكنولوجيا,تستخدم الحواسيب في التنبؤ بحالة الطقس
هل يعد الزيت النباتي مصدرا للطاقة المتجددة,التكنولوجيا,يعد الزيت النباتي مصدرا للطاقة المتجددة
هل تعتبر النملة من الحشرات,التعليم,النملة تعتبر من الحشرات
هل يمكن للإنسان أن يسمع الأصوات ذات التردد العالي جدا,الصحة,لا يمكن للإنسان أن يسمع الأصوات ذات التردد العالي جدا
هل يعد البحر الأحمر من الممرات البحرية الهامة,الجغرافيا,يعد البحر الأحمر من الممرات البحرية الهامة
هل تعتبر القارة الأفريقية الأكبر من حيث المساحة,التعليم,القارة الآسيوية هي الأكبر من حيث المساحة
هل يستخدم الصوديوم في صناعة الملح,التكنولوجيا,يستخدم الصوديوم في صناعة الملح
هل تعد الأشجار مصدرا للأوكسجين,البيئة والطاقة,تعد الأشجار مصدرا للأوكسجين
هل يمكن للأفاعي أن تسمع الأصوات,التعليم,الأفاعي لا تسمع الأصوات ولكنها تشعر بالاهتزازات
هل يعد الكمبيوتر من الأدوات الحديثة,التكنولوجيا,يعد الكمبيوتر من الأدوات الحديثة
هل تعتبر الدببة من الحيوانات اللاحمة,التعليم,تعتبر الدببة من الحيوانات اللاحمة
هل يستخدم السيليكون في صناعة الرقائق الإلكترونية,التكنولوجيا,يستخدم السيليكون في صناعة الرقائق الإلكترونية
هل تعتبر النباتات مصدر غذاء رئيسي للحيوانات العاشبة,البيئة والطاقة,تعتبر النباتات مصدر غذاء رئيسي للحيوانات العاشبة
هل تعد الألماس من المعادن,التعليم,الألماس ليس من المعادن
هل كان لأرسطو تأثير كبير على الفلسفة الغربية,الثقافة,كان لأرسطو تأثير كبير على الفلسفة الغربية
هل يمكن للإنسان أن يعيش بدون كبد,الصحة,لا يمكن للإنسان أن يعيش بدون كبد
هل يعتبر الأوكسجين ضروريا لعملية التنفس,الصحة,الأوكسجين ضروري لعملية التنفس
هل يمكن للإنسان أن يتذوق الطعام بدون لسان,الصحة,يمكن للإنسان أن يتذوق الطعام بدون لسان
هل يمكن للإنسان أن يعيش بدون غذاء لفترة طويلة,الصحة,يمكن للإنسان أن يعيش بدون غذاء لفترة طويلة
هل تستخدم الفيتامينات في تعزيز الصحة العامة,الصحة,تستخدم الفيتامينات في تعزيز الصحة العامة
هل يمكن للإنسان أن يتنفس في الفضاء بدون معدات,التعليم,يمكن للإنسان أن يتنفس في الفضاء بدون معدات
هل يمكن للإنسان أن يرى الأشياء بدون الضوء,التعليم,يمكن للإنسان أن يرى الأشياء بدون الضوء
هل يتناول الدجاج نوعا معينا من الطعام,الصحة,يتناول الدجاج أنواعا معينة من الطعام تتضمن الحبوب والبذور وأحيانا الحشرات
هل لدى الدجاج نظام غذائي محدد,الصحة,لدى الدجاج نظام غذائي محدد يعتمد على الحبوب والبذور وأحيانا الحشرات
هل كانت جهود المرأة من أجل المساواة في الحقوق أثناء الحركة النسائية ناجحة,السياسة والقانون,كانت جهود المرأة من أجل المساواة في الحقوق أثناء الحركة النسائية ناجحة في تحقيق العديد من التغييرات القانونية والاجتماعية
هل هناك علاقة بين الخوف أو الاضطرابات النفسية والشيب,الصحة,هناك علاقة بين الخوف أو الاضطرابات النفسية والشيب حيث يمكن أن يسبب التوتر النفسي تسريع ظهور الشيب
هل كانت الأشرطة قابلة للاستعاده والمعالجة دون تدمير المشروعية التاريخية أم أن بعض جوانب الأشرطة فقدت مشروعيتها,التكنولوجيا,بعض جوانب الأشرطة فقدت مشروعيتها التاريخية أثناء الاستعادة والمعالجة
هل كانت الأشرطة المستعادة قابلة لإضافة لون إليها لتحسين الصورة أم أنها بقيت بالأبيض والأسود,التكنولوجيا,بقيت الأشرطة المستعادة بالأبيض والأسود ولم تكن قابلة لإضافة لون إليها
هل انضمت النرويج بالنهاية إلى الاتحاد الأوروبي سنة 1972,السياسة والقانون,لم تنضم النرويج إلى الاتحاد الأوروبي سنة 1972
هل حقق الأردن الاكتفاء الذاتي في زيت الزيتون,السياسة والقانون,يعتبر القطاع الزراعي من القطاعات المهمة في الأردن وتلعب الزراعة دورا هاما في المنظومة الاقتصادية والاجتماعية للمجتمعات الريفية كما ترتبط ارتباطا وثيقا بجهود المحافظة على البيئة الطبيعية واستمراريتها يواجه القطاع الزراعي في الأردن مشاكل وتحديات متمثلة في توالي سنوات الجفاف تذبذب الأمطار قلة الأراضي الزراعية ندرة الموارد المائية والمخاطر المختلفة يساهم القطاع الزراعي بما نسبته 56  من الناتج المحلي الإجمالي ويعمل فيه 35 من مجموع القوى العاملة وتشكل الصادرات الزراعية 154 من مجموع صادرات المملكة يذهب 905  منها إلى الأسواق العربية حقق الأردن الاكتفاء الذاتي في عدد من المنتجات الزراعية كزيت الزيتون اللبن إلا أن الكثير من المنتجات الغذائية الأساسية كأنواع القمح ومشتقات الحليب والسكر اللحوم الحمراء والخضراوات تستورد من الخارج نمت الصادرات من المنتجات الزراعية بنسبة 369 عام 2005 مقارنة بما قيمته 282 عام 2004 ومن أهم الصادرات الزراعية الطماطم الزيوت المهدرجة والسجائر أهم الدول المستوردة هي العراق الإمارات العربية المتحدة وسوريا
هل تعد الطماطم من أهم صادرات الأردن الزراعية,السياسة والقانون,يعتبر القطاع الزراعي من القطاعات المهمة في الأردن وتلعب الزراعة دورا هاما في المنظومة الاقتصادية والاجتماعية للمجتمعات الريفية كما ترتبط ارتباطا وثيقا بجهود المحافظة على البيئة الطبيعية واستمراريتها يواجه القطاع الزراعي في الأردن مشاكل وتحديات متمثلة في توالي سنوات الجفاف تذبذب الأمطار قلة الأراضي الزراعية ندرة الموارد المائية والمخاطر المختلفة يساهم القطاع الزراعي بما نسبته 56  من الناتج المحلي الإجمالي ويعمل فيه 35 من مجموع القوى العاملة وتشكل الصادرات الزراعية 154 من مجموع صادرات المملكة يذهب 905  منها إلى الأسواق العربية حقق الأردن الاكتفاء الذاتي في عدد من المنتجات الزراعية كزيت الزيتون اللبن إلا أن الكثير من المنتجات الغذائية الأساسية كأنواع القمح ومشتقات الحليب والسكر اللحوم الحمراء والخضراوات تستورد من الخارج نمت الصادرات من المنتجات الزراعية بنسبة 369 عام 2005 مقارنة بما قيمته 282 عام 2004 ومن أهم الصادرات الزراعية الطماطم الزيوت المهدرجة والسجائر أهم الدول المستوردة هي العراق الإمارات العربية المتحدة وسوريا
هل تم قبول فكرة الصرفة بشكل واسع بين العلماء المسلمين,الدين,غير أن بعضهم قالوا بأن فكرة الإعجاز يجب الا تفهم هذا الفهم الضيق ومنهم إبراهيم النظام الذي أدخل إلى النقاش الدائر بين العلماء فكرة الصرفة قائلا إن إعجاز القرآن الكريم يقوم على أن الله صرف العرب عن معارضته بأن سلب علومهم به ولم يقبل هذا الفكرة إلا قلائل
هل يمكن لأي شخص أن يأتي بمثل القرآن وفقا للمعتقد الإسلامي,الدين,والإعجاز القرآني مصطلح يدل على قصور الإنس والجن عن أن يأتوا بمثل القرآن الكريم أو بسورة من مثله
هل قبل العلماء المسلمون فكرة الصرفة بالإجماع,الدين,غير أن بعضهم قالوا بأن فكرة الإعجاز يجب الا تفهم هذا الفهم الضيق ومنهم إبراهيم النظام الذي أدخل إلى النقاش الدائر بين العلماء فكرة الصرفة قائلا إن إعجاز القرآن الكريم يقوم على أن الله صرف العرب عن معارضته بأن سلب علومهم به ولم يقبل هذا الفكرة إلا قلائل
هل يمكن للمواد المسرطنة أن تؤدي إلى موت الخلايا,الصحة,عادة ما يؤدي تلف الحمض النووي في الحالات الحادة التي يصعب علاجها إلى موت الخلايا المبرمج
هل ارتفعت قيمة الصادرات الزراعية في عام 2006,السياسة والقانون,ارتفعت قيمة الصادرات الزراعية بنسبة 173 خلال عام 2006
هل يمتلك الأردن حصة فردية من موارد المياه المتجددة تعد من أدنى الحصص في العالم,السياسة والقانون,وتعتبر حصة الفرد من موارد المياه المتجددة من أدنى الحصص في العالم
هل تعرض التاريخ الإسلامي لغزو فكري,التاريخ,تعرض التاريخ الإسلامي لأكبر قدر من الغزو الفكري
هل كانت الجزيرة العربية قبل ظهور الإسلام مجموعة من القبائل العربية,التاريخ,كانت الجزيرة العربية قبل ظهور الإسلام مجموعة من القبائل العربية
هل يشمل التاريخ الإسلامي الفترة الأموية,التاريخ,يمتد التاريخ الإسلامي منذ بداية الدعوة الإسلامية مرورا بالدولة الأموية
هل تختلف وجهات نظر المحللين في تفسير التاريخ الإسلامي,التاريخ,تختلف وجهات النظر التي تحاول شرح وتفسير التاريخ الإسلامي حسب الخلفيات الأيديولوجية والأدوات التحليلية المستخدمة
هل جمع زيد بن ثابت القرآن في عهد أبي بكر,التاريخ,فأمر الصديق زيد بن ثابت بجمعه
هل تمت توسعة المسجد النبوي في عهد عثمان,التاريخ,تمت في عهده توسعة المسجد النبوي عام 29  30 هـ
هل جمع زيد بن ثابت القرآن في عهد أبي بكر,التاريخ,فأمر الصديق زيد بن ثابت بجمعه
هل تمت توسعة المسجد النبوي في عهد عثمان,التاريخ,تمت في عهده توسعة المسجد النبوي عام 29  30 هـ
هل قاتل المسلمون ضد المرتدين في عهد أبي بكر,التاريخ,نعم قاتل المسلمون المرتدين في حروب الردة
هل استطاع المسلمون فتح القدس,التاريخ,نعم استطاع المسلمون فتح القدس
هل قام زيد بن ثابت بجمع القرآن في عهد أبي بكر,التاريخ,فأمر الصديق زيد بن ثابت بجمعه
هل استطاع المسلمون فتح القدس,التاريخ,فركب إليهم في جنوده وحاصر بيت المقدس وضيق عليهم حتى أجابوا إلى الصلح
هل كانت خلافة عبد الملك بن مروان مليئة بالفتن والانقسامات,التاريخ,تولي الحكم سنة 65 هـ والدولة في حالة انقسام وضعف
هل أسس الفاطميون الجامع الأزهر,التاريخ,أنشأوا بها الجامع الأزهر
